{
  "harness_version": "1.0.0",
  "profile": "ml",
  "derived_from": {
    "raw_md_sha": "8d6ebaff7594b07a62f9ba44c17e92ee8f72ecae21fd67eb762e3e8f62a296f6",
    "harness_md_sha": "5b209646b320336f07fbcb0b180f30bd0085ca9a6071d4a140bbc6c145dcddcb"
  },
  "mode": "EXECUTE",
  "sprint": 4,
  "task_id": "T-0004",
  "current_stage": "done",
  "stages": {
    "spec": "complete",
    "design": "complete",
    "plan": "complete",
    "tests": "complete",
    "build": "complete",
    "review": "complete",
    "qa": "complete",
    "docs": "complete"
  },
  "lanes": [],
  "attempts": {
    "spec": 1,
    "build": 1,
    "qa": 1
  },
  "last_commit": "fa8492d",
  "last_gate": {
    "name": "G5",
    "status": "pass",
    "at": "2026-10-25T22:55:00Z"
  },
  "breaker": {
    "tripped": false,
    "reason": null
  },
  "updated_at": "2026-10-25T22:55:00Z"
}
